{
  "$schema": "https://json-schema.org/draft/2020-12/schema",
  "$id": "https://github.com/fatb4f/runtime/schemas/runtime.slice.v0.json",
  "title": "Runtime Slice Manifest",
  "description": "Defines one closed executable slice and its position in a parent issue sequence.",
  "type": "object",
  "additionalProperties": false,
  "required": [
    "schema",
    "sliceID",
    "parent",
    "predecessor",
    "next",
    "objective",
    "inputs",
    "allowedMutationPaths",
    "forbiddenMutationPaths",
    "focusedValidation",
    "closureValidation",
    "completionCriteria",
    "nonGoals"
  ],
  "properties": {
    "schema": {
      "description": "Discriminator identifying the closed slice-manifest contract.",
      "const": "runtime.slice.v0"
    },
    "sliceID": {
      "description": "Stable logical identity of the slice; independent of its GitHub issue number.",
      "type": "string",
      "minLength": 1,
      "pattern": "^[a-z0-9][a-z0-9._-]*$"
    },
    "parent": {
      "description": "Coordinates of the parent orchestration issue. Its repository must equal the repository containing this slice manifest.",
      "$ref": "#/$defs/issueCoordinate"
    },
    "predecessor": {
      "description": "Immediate predecessor slice, or null for the first slice.",
      "oneOf": [
        {
          "$ref": "#/$defs/sliceReference"
        },
        {
          "type": "null"
        }
      ]
    },
    "next": {
      "description": "Immediate successor slice, or null for the terminal slice.",
      "oneOf": [
        {
          "$ref": "#/$defs/sliceReference"
        },
        {
          "type": "null"
        }
      ]
    },
    "objective": {
      "description": "Single bounded outcome the active session must produce.",
      "type": "string",
      "minLength": 1
    },
    "inputs": {
      "description": "Prior artifacts, decisions, or evidence admitted as inputs to this slice.",
      "type": "array",
      "items": {
        "type": "string",
        "minLength": 1
      }
    },
    "allowedMutationPaths": {
      "description": "Repository-relative paths or path prefixes that this slice may modify.",
      "type": "array",
      "items": {
        "$ref": "#/$defs/repositoryRelativePath"
      }
    },
    "forbiddenMutationPaths": {
      "description": "Repository-relative paths that remain explicitly outside the slice boundary.",
      "type": "array",
      "items": {
        "$ref": "#/$defs/repositoryRelativePath"
      }
    },
    "focusedValidation": {
      "description": "Commands required to validate the slice-specific implementation.",
      "type": "array",
      "items": {
        "$ref": "#/$defs/command"
      }
    },
    "closureValidation": {
      "description": "Repository-level commands required before the slice may be declared complete.",
      "type": "array",
      "items": {
        "$ref": "#/$defs/command"
      }
    },
    "completionCriteria": {
      "description": "Observable conditions that must hold before the slice is complete.",
      "type": "array",
      "items": {
        "type": "string",
        "minLength": 1
      }
    },
    "nonGoals": {
      "description": "Capabilities or changes that must not be introduced by this slice.",
      "type": "array",
      "items": {
        "type": "string",
        "minLength": 1
      }
    }
  },
  "$defs": {
    "repositoryRelativePath": {
      "description": "Normalized POSIX repository-relative path or prefix, optionally ending in one slash.",
      "type": "string",
      "minLength": 1,
      "pattern": "^(?!/)(?!.*//)(?!.*(?:^|/)\\.\\.?(?:/|$))[^/\\u0000]+(?:/[^/\\u0000]+)*/?$"
    },
    "issueCoordinate": {
      "description": "Coordinates identifying one GitHub issue.",
      "type": "object",
      "additionalProperties": false,
      "required": [
        "repository",
        "issue"
      ],
      "properties": {
        "repository": {
          "description": "GitHub repository in owner/name form.",
          "type": "string",
          "pattern": "^[^/]+/[^/]+$"
        },
        "issue": {
          "description": "Positive GitHub issue number.",
          "type": "integer",
          "minimum": 1
        }
      }
    },
    "sliceReference": {
      "description": "Logical and remote coordinates of an adjacent slice.",
      "type": "object",
      "additionalProperties": false,
      "required": [
        "sliceID",
        "issue"
      ],
      "properties": {
        "sliceID": {
          "description": "Stable logical identity of the referenced slice.",
          "type": "string",
          "minLength": 1
        },
        "issue": {
          "description": "GitHub issue number containing the referenced slice manifest.",
          "type": "integer",
          "minimum": 1
        }
      }
    },
    "command": {
      "description": "Exact executable command declaration without shell-string token inference.",
      "oneOf": [
        {
          "type": "object",
          "additionalProperties": false,
          "required": [
            "kind",
            "argv"
          ],
          "properties": {
            "kind": {
              "description": "Identifies an argument-vector command.",
              "const": "argv"
            },
            "argv": {
              "description": "Exact executable and argument vector.",
              "type": "array",
              "minItems": 1,
              "items": {
                "type": "string"
              }
            }
          }
        },
        {
          "type": "object",
          "additionalProperties": false,
          "required": [
            "kind",
            "command"
          ],
          "properties": {
            "kind": {
              "description": "Identifies an opaque shell command.",
              "const": "shell"
            },
            "command": {
              "description": "Exact shell text; consumers must not synthesize argv by splitting it.",
              "type": "string",
              "minLength": 1
            }
          }
        }
      ]
    }
  }
}
