{
  "schema": "runtime.slice.v0",
  "sliceID": "minimal",
  "parent": {
    "repository": "fatb4f/runtime",
    "issue": 1
  },
  "predecessor": null,
  "next": null,
  "objective": "Validate the minimal fixture.",
  "inputs": [],
  "allowedMutationPaths": [
    "src/",
    ".codex/config.json"
  ],
  "forbiddenMutationPaths": [
    ".git/"
  ],
  "focusedValidation": [
    {
      "kind": "argv",
      "argv": [
        "pytest",
        "-q"
      ]
    }
  ],
  "closureValidation": [],
  "completionCriteria": [
    "The fixture validates."
  ],
  "nonGoals": []
}
